pub_date,headline,abstract,lead_paragraph,snippet,news_desk,date
2024-11-22 00:00:07+00:00,How Hostility to Immigrants Will Hurt America’s Tech Sector,Don’t assume that highly educated foreigners will be spared by the new administration.,"Will business prosper under a second Donald Trump presidency? As far as I can tell, many business leaders are pinning their hopes on the belief that he won’t actually follow through on his campaign pledges on tariffs and mass deportation — that they’ll be like his border wall, which, for the most part, he never built but claimed he had.",Don’t assume that highly educated foreigners will be spared by the new administration.,OpEd,2024-11-22
2024-11-22 00:04:53+00:00,"Trump Picks Pam Bondi, Florida’s Former Top Prosecutor, for Attorney General After Gaetz Withdraws","In Ms. Bondi, who served on his legal team during his first impeachment, the president-elect turned to a loyal ally to put his stamp on a Justice Department that he sees as hostile to him.","President-elect Donald J. Trump said on Thursday that he would nominate Pam Bondi to be attorney general, turning to a longtime loyalist who served as state attorney general in Florida to put his stamp on a Justice Department that he sees as politically hostile to him.","In Ms. Bondi, who served on his legal team during his first impeachment, the president-elect turned to a loyal ally to put his stamp on a Justice Department that he sees as hostile to him.",Washington,2024-11-22
2024-11-22 00:06:40+00:00,"Peter Sinfield, Poetic Lyricist for Prog Rock’s King Crimson, Dies at 80",His swirls of imagery helped define progressive rock in the 1970s. He later turned his focus to pop acts like Celine Dion.,"Peter Sinfield, whose mystical and at times politically pointed lyrics for the British band King Crimson became emblematic of the progressive rock movement of the 1970s, died on Nov. 14 in London. He was 80.",His swirls of imagery helped define progressive rock in the 1970s. He later turned his focus to pop acts like Celine Dion.,Obits,2024-11-22
2024-11-22 00:16:11+00:00,Phillips 66 Is Accused of Violating the Clean Water Act,"The oil company was indicted on charges of dumping nearly 800,000 gallons of contaminated wastewater into the Los Angeles County sewer system.","A federal grand jury on Wednesday indicted Phillips 66 on charges of violating the Clean Water Act by dumping nearly 800,000 gallons of contaminated wastewater into the Los Angeles County sewer system and failing to report the incident to authorities.","The oil company was indicted on charges of dumping nearly 800,000 gallons of contaminated wastewater into the Los Angeles County sewer system.",Business,2024-11-22
2024-11-22 00:25:12+00:00,"M.I.T. to Offer Free Tuition to Families Earning Less Than $200,000","For students whose families earn less than $100,000 per year, the school will also cover other costs, including housing, dining, fees and an allowance for books and personal expenses.","The Massachusetts Institute of Technology announced on Wednesday that it would eliminate tuition costs next fall for all undergraduate students whose families earn less than $200,000 per year — following a national movement to try to make higher education more accessible.","For students whose families earn less than $100,000 per year, the school will also cover other costs, including housing, dining, fees and an allowance for books and personal expenses.",Express,2024-11-22
2024-11-22 00:37:43+00:00,Why a Police Shooting Victim’s Family Won’t Get a $100 Million Payout,"Cities have paid out billions of dollars in police misconduct cases, but depending on the case, families may not receive any money at all. A recent $100 million penalty for a police shooting case in Dallas may never lead to a payout.","The family of George Floyd received $27 million after he was killed by police officers in Minneapolis. The family of Breonna Taylor got $12 million. Richard Cox, who was paralyzed after a ride in a police van in New Haven, Conn., got $46 million.","Cities have paid out billions of dollars in police misconduct cases, but depending on the case, families may not receive any money at all. A recent $100 million penalty for a police shooting case in Dallas may never lead to a payout.",National,2024-11-22
2024-11-22 00:41:41+00:00,Three Short Posts Show a New Power Dynamic Between Musk and Bezos,"The world’s two richest men are longtime business rivals, but now one of them has the ear of the next president of the United States.","A few months ago, a three-post exchange between Jeff Bezos and Elon Musk on Mr. Musk’s X would have passed for petty sniping between billionaire rivals.","The world’s two richest men are longtime business rivals, but now one of them has the ear of the next president of the United States.",Business,2024-11-22
2024-11-22 00:41:41+00:00,Marjorie Taylor Greene Will Lead New ‘DOGE’ Panel on Government Efficiency,The rise of the Republican representative from Georgia signals the ascendancy of the MAGA wing of the G.O.P. in Congress.,"When she arrived in Congress in 2021, Representative Marjorie Taylor Greene, Republican of Georgia, was quickly stripped of her two committee assignments by Democrats and shunned by her colleagues on Capitol Hill.",The rise of the Republican representative from Georgia signals the ascendancy of the MAGA wing of the G.O.P. in Congress.,Washington,2024-11-22
2024-11-22 01:02:41+00:00,The Road to Trump’s ‘Grand New Party’,Ross Douthat and Reihan Salam had a vision for how Republicans could reclaim the working class. They never expected Trump to fulfill it.,Ross Douthat and Reihan Salam had a vision for how Republicans could reclaim the working class. They never expected Trump to fulfill it.,Ross Douthat and Reihan Salam had a vision for how Republicans could reclaim the working class. They never expected Trump to fulfill it.,,2024-11-22
2024-11-22 01:02:54+00:00,West Bank Settlement Supporters Have Big Hopes for Trump’s Presidency,"As Donald J. Trump nominates staunch supporters of Israel to key positions, advocacy groups are taking aim at the departing administration's policies.","The Biden administration this week imposed sanctions on more groups and individuals it accuses of having ties to Israeli settlers inciting violence in the occupied West Bank, a last-ditch show of disapproval of Israelis’ annexation of land there before U.S. policy on the issue most likely swings the other way under the next administration.","As Donald J. Trump nominates staunch supporters of Israel to key positions, advocacy groups are taking aim at the departing administration's policies.",Foreign,2024-11-22
2024-11-22 01:36:26+00:00,"As a Lobbyist, Bondi Had Clients Including Amazon, G.M., Uber and Qatar",President-elect Donald J. Trump’s new choice to be attorney general joined a powerhouse Republican firm after her second term as Florida’s attorney general.,"President-elect Donald J. Trump’s pick to be attorney general, Pam Bondi, is a lobbyist for a powerhouse Republican firm, for which she represented major corporations and foreign governments with interests before the U.S. government.",President-elect Donald J. Trump’s new choice to be attorney general joined a powerhouse Republican firm after her second term as Florida’s attorney general.,Washington,2024-11-22
2024-11-22 01:48:47+00:00,China’s Hacking Reached Deep Into U.S. Telecoms,The chairman of the Senate Intelligence Committee said hackers listened to phone calls and read texts by exploiting aging equipment and seams in the networks that connect systems.,"China’s recent breach of the innermost workings of the U.S. telecommunications system reached far deeper than the Biden administration has described, the chairman of the Senate Intelligence Committee said on Thursday, with hackers able to listen in on telephone conversations and read text messages.",The chairman of the Senate Intelligence Committee said hackers listened to phone calls and read texts by exploiting aging equipment and seams in the networks that connect systems.,Washington,2024-11-22
2024-11-22 02:00:08+00:00,"Review: In ‘Death Becomes Her,’ Spiking the Fountain of Youth",Hilarious star turns from Megan Hilty and Jennifer Simard make the mostly unfunny 1992 film into an intermittently memorable Broadway musical.,"Not since Alfred Lunt and Lynn Fontanne themselves performed there in 1958, leaving a trail of scrapes and bite marks in their wake, has Broadway’s Lunt-Fontanne Theater housed such equal-billing dragons as the ones Megan Hilty and Jennifer Simard play in “Death Becomes Her.” The musical, which opened on Thursday, stars the two comic treasures as lifelong frenemies for whom the “lifelong” part is an understatement. Their animosity is eternal.",Hilarious star turns from Megan Hilty and Jennifer Simard make the mostly unfunny 1992 film into an intermittently memorable Broadway musical.,Weekend,2024-11-22
2024-11-22 02:40:01+00:00,"Corrections: Nov. 22, 2024","Corrections that appeared in print on Friday, Nov. 22, 2024.","An article on Thursday about the prison sentence for Bill Hwang, the founder of Archegos Capital Management, misstated the office that prepared his presentencing report. It was prepared by the probation department, not by the prosecution.","Corrections that appeared in print on Friday, Nov. 22, 2024.",Corrections,2024-11-22
2024-11-22 02:56:04+00:00,Pam Bondi Is Trump’s New Choice for Attorney General. Here’s What to Know About Her.,"Florida’s first female state attorney general, she became a member of Donald Trump’s impeachment defense team and backed his false claims of election fraud in 2020.","President-elect Donald J. Trump quickly swept aside Thursday’s bad headlines about Matt Gaetz by speedily substituting Pam Bondi, a fellow Florida Republican with a starkly different profile — but a similar reputation for fealty — to be his attorney general.","Florida’s first female state attorney general, she became a member of Donald Trump’s impeachment defense team and backed his false claims of election fraud in 2020.",Washington,2024-11-22
2024-11-22 03:00:02+00:00,Field of Stars,Sarah Sinclair and Rafael Musa invite solvers to a tug of war.,Jump to: Tricky Clues,Sarah Sinclair and Rafael Musa invite solvers to a tug of war.,Games,2024-11-22
2024-11-22 03:00:07+00:00,‘The Blood Quilt’ Review: An Elaborate Tapestry,Katori Hall’s new play about sisters gathering after their mother’s death features standout performances but an overabundance of themes.,"Quilting is about more than just fabric and stitches; it’s about blood, love, memory and trauma. That’s the premise at the center of Katori Hall’s “The Blood Quilt” at Lincoln Center, about four sisters gathering to complete a quilt three weeks after their mother’s death. The play itself a beautiful patchwork of themes and ideas that feel packed to the seams.",Katori Hall’s new play about sisters gathering after their mother’s death features standout performances but an overabundance of themes.,Culture,2024-11-22
2024-11-22 03:36:00+00:00,"Police in New Jersey’s Capital Violate Residents’ Rights, U.S. Finds","Officers in Trenton have caused the deaths of innocent people, a Justice Department report found, citing a fatality that occurred after officers pushed a man’s face into the ground.","Police officers in Trenton, N.J., systematically violate the constitutional rights of the city’s residents, conduct illegal searches and needlessly escalate peaceful interactions into violence, the U.S. Department of Justice found in a report published Thursday.","Officers in Trenton have caused the deaths of innocent people, a Justice Department report found, citing a fatality that occurred after officers pushed a man’s face into the ground.",Metro,2024-11-22
2024-11-22 04:59:00+00:00,Quote of the Day: Crypto Entrepreneur Pays $6.2 Million for Banana-as-Art,"Quotation of the Day for Friday, November 22, 2024",“I bet the Sotheby’s staff absolutely can’t wait to stop having to listen to banana jokes and pretend like it’s the first time they heard them.”,"Quotation of the Day for Friday, November 22, 2024",Summary,2024-11-22
2024-11-22 05:00:17+00:00,‘Star Wars’ Actress Finds the ‘Cool Nerd’ She Sought. A ‘Bridgerton’ Wedding Followed.,"Philicia Saunders and Jordan Wilson discovered a mutual love of cosplay, anime, video games — and, eventually, each other.",“I’m literally a walking nerd billboard.” That’s how Jordan Alexander Wilson describes himself.,"Philicia Saunders and Jordan Wilson discovered a mutual love of cosplay, anime, video games — and, eventually, each other.",Styles,2024-11-22
2024-11-22 05:00:27+00:00,Their Life as a Classic Movie (With a Modern Twist),"Sydney Reade and Samuel Zweighaft, both fans of the TCM channel, met four years ago. Their first conversation lasted four hours.","Sydney Dana Reade was drawn to Samuel Bennett Zweighaft’s Hinge profile in mid-January 2021 after seeing the initials TCM, which she immediately recognized as Turner Classic Movies, the classic film TV channel.","Sydney Reade and Samuel Zweighaft, both fans of the TCM channel, met four years ago. Their first conversation lasted four hours.",Styles,2024-11-22
2024-11-22 05:00:27+00:00,Sharing More Than a Last Name,"Haley Cohen and Jason Cohen met briefly as children, then matched on an app as adults. “It just seemed like fate,” the groom said.","When Haley Alexandra Cohen and Jason Dean Cohen were matched on the Jewish dating app JSwipe in November 2019, they instantly realized that their connection went back years — to when they were 8, to be exact.","Haley Cohen and Jason Cohen met briefly as children, then matched on an app as adults. “It just seemed like fate,” the groom said.",Styles,2024-11-22
2024-11-22 05:00:37+00:00,"Six Weeks After Their First Date, They Moved to Paris","Soon after they met, Delanie Linden and Zack Burton took a leap of faith and flew to France. There, they fell in love.","When Delanie Joy Linden first saw Zachary Florentino Murguía Burton, he was lost.","Soon after they met, Delanie Linden and Zack Burton took a leap of faith and flew to France. There, they fell in love.",Styles,2024-11-22
2024-11-22 05:00:38+00:00,When the Cost of Being Unmarried Is Too High,"In an uncertain world, a marriage skeptic comes around.","In February 2022, a few days after Russia invaded Ukraine, I sent my partner a panicked text: “Maybe we should get married.”","In an uncertain world, a marriage skeptic comes around.",Styles,2024-11-22
2024-11-22 05:01:11+00:00,Britain Faces a Dilemma: Cozy Up to Trump or Reconnect With Europe?,A Trump administration may force Prime Minister Keir Starmer to choose between his country’s most powerful ally and its biggest trading partner.,When Prime Minister Keir Starmer of Britain joined President Emmanuel Macron of France in Paris last week to celebrate Armistice Day — the first British leader to do so since Winston Churchill in 1944 — it was a striking illustration of his Labour government’s desire to reset relations with Europe.,A Trump administration may force Prime Minister Keir Starmer to choose between his country’s most powerful ally and its biggest trading partner.,Foreign,2024-11-22
2024-11-22 05:10:27+00:00,Friday Briefing,Donald Trump’s new choice for attorney general.,"Hours after Matt Gaetz abruptly withdrew from consideration as attorney general, President-elect Donald Trump announced that he would nominate Pam Bondi, a former Florida attorney general, for the role.",Donald Trump’s new choice for attorney general.,NYTNow,2024-11-22
2024-11-22 05:29:26+00:00,Chuck Scarborough to Step Down as WNBC News Anchor After 50-Year Career,"The celebrated broadcaster, who started at the New York station in 1974, announced that he would wrap up his anchoring career on Dec. 12.","Chuck Scarborough, the broadcaster who for 50 years brought New Yorkers news of blizzards, financial collapses, terror attacks and assassinations, said Thursday that he would step down from his anchoring duties at WNBC.","The celebrated broadcaster, who started at the New York station in 1974, announced that he would wrap up his anchoring career on Dec. 12.",Express,2024-11-22
2024-11-22 06:00:04+00:00,What Democrats Are Getting Wrong About Transgender Rights,Trans rights aren’t just trans rights. They’re reproductive rights.,"In the wake of an election in which Donald Trump stoked fear about trans people — as in the much-discussed ad that warned “Kamala is for they/them. President Trump is for you” — Democrats are now debating how much the issue of trans rights hurt them and how fast they should retreat from it. Which is remarkable, because throughout her brief campaign, Kamala Harris was all but silent on the subject. It’s not clear how much further Democrats could actually retreat.",Trans rights aren’t just trans rights. They’re reproductive rights.,OpEd,2024-11-22
2024-11-22 06:52:36+00:00,Late Night Can’t Believe Matt Gaetz Won’t Be Attorney General,"Jimmy Kimmel said the scandal-ridden ex-congressman’s withdrawal was “exciting news for Judge Jeanine Pirro, who will be our next attorney general.”","Welcome to Best of Late Night, a rundown of the previous night’s highlights that lets you sleep — and lets us get paid to watch comedy. Here are the 50 best movies on Netflix right now.","Jimmy Kimmel said the scandal-ridden ex-congressman’s withdrawal was “exciting news for Judge Jeanine Pirro, who will be our next attorney general.”",Culture,2024-11-22
2024-11-22 07:00:02+00:00,Word of the Day: provost,This word has appeared in 87 articles on NYTimes.com in the past year. Can you use it in a sentence?,"The word provost has appeared in 87 articles on NYTimes.com in the past year, including on Aug. 15 in “Harvard Names Conservative Legal Scholar as Permanent Provost” by Anemona Hartocollis:",This word has appeared in 87 articles on NYTimes.com in the past year. Can you use it in a sentence?,Learning,2024-11-22
2024-11-22 08:00:04+00:00,Spelling Bee Forum,Feeling stuck on today’s puzzle? We can help.,"Hi busy bees! Welcome to today’s Spelling Bee forum. There are a number of terms that appear in both this article and other online discussions of the Spelling Bee; a glossary of those terms compiled by Monicat, a Times reader, can be found below.",Feeling stuck on today’s puzzle? We can help.,Games,2024-11-22
2024-11-22 08:00:14+00:00,"After Banning Booze for 120 Years, a Town Prepares to Open the Tap","Haddon Heights, N.J., voted to issue liquor licenses for the first time in its history. Not everyone is happy.","As suburbs go, Haddon Heights, N.J., has a lot to recommend it. Kids can walk to school and play safely under leafy trees. It’s close to Philadelphia, but full of small-town charm. It has an almost century-old grocery store, good restaurants, plenty of longtime residents and small business owners who know one another by name.","Haddon Heights, N.J., voted to issue liquor licenses for the first time in its history. Not everyone is happy.",Metro,2024-11-22
2024-11-22 08:00:16+00:00,"New York’s Soccer Clubs Meet in a Playoff, and the Loathing Is Mutual","The Red Bulls and the New York City Football Club face one another on Saturday. Much of the metro area is blasé, but the fan bases are frothing.",It does not produce the passions stirred by Barcelona versus Madrid. It does not make New York stop dead like Buenos Aires does when River Plate plays Boca Juniors. It does not even match the historical enmity of Islanders-Rangers hockey at Madison Square Garden.,"The Red Bulls and the New York City Football Club face one another on Saturday. Much of the metro area is blasé, but the fan bases are frothing.",Metro,2024-11-22
2024-11-22 08:00:19+00:00,A Surprise,"Tell us a story, real or made up, that is inspired by this image.","Use your imagination to write the opening of a short story or poem inspired by this illustration, or describe a memory from your own life that this image makes you think of.","Tell us a story, real or made up, that is inspired by this image.",Learning,2024-11-22
2024-11-22 08:00:22+00:00,The Liberal New Yorkers Who Say They’re Tuning Out the News,"In the wake of the election, some New York City news addicts are quitting cold turkey. Can they really keep it up?","Since the presidential election more than two weeks ago, it has been common to hear certain kinds of left-leaning, reflective New Yorkers declare that they were breaking up with the news. The prospect of a second Trump administration with all the anticipated chaos felt like too much — they were drained, exhausted, resigned, ready to choose a plaintive ignorance. These were high-information voters who mainlined political coverage through every available 21st- century platform; a month ago they would have been able to give you the over-under on statehouse races in rural Ohio.","In the wake of the election, some New York City news addicts are quitting cold turkey. Can they really keep it up?",Metropolitan,2024-11-22
2024-11-22 08:01:07+00:00,‘Spellbound’ Review: Borrowed Wonder,"Any magic this animated musical has feels distinctly, almost insultingly poached.","Princess Ellian, heir to the throne of Lumbria, has a problem: A year earlier, her parents, traveling through the Dark Forest of Eternal Darkness, fell under a curse. That sort of thing happens when you’re passing through a wood “so dark they named it twice” — but let’s not cast blame. The curse transformed the king and queen into roaring, rampaging monsters. They can’t comprehend much or speak, but they can be distracted with chew toys.","Any magic this animated musical has feels distinctly, almost insultingly poached.",Weekend,2024-11-22
2024-11-22 09:38:07+00:00,"An Asteroid’s Destruction May Have Given Mars Rings, Then Moons",Scientists simulated a situation that may offer an improved explanation for how the Red Planet ended up with small Phobos and tiny Deimos.,"Something’s not quite right about the moons of Mars. They are too small — Phobos is 17 miles across, and Deimos is a mere nine miles in length. And they aren’t round, but lumpy, misshaped objects. Frankly, they don’t resemble moons at all.",Scientists simulated a situation that may offer an improved explanation for how the Red Planet ended up with small Phobos and tiny Deimos.,Science,2024-11-22
2024-11-22 10:00:14+00:00,"A Stroke Paralyzed Jesse Malin. Next Month, He’ll Stand Onstage Again.",The New York rock stalwart suffered a rare spinal stroke at a dinner party last year. His journey back to music has been filled with painful challenges and hope.,"On a September afternoon in his East Village apartment, Jesse Malin was learning to stand up in front of a microphone. He pressed his right hand on his knee and grabbed a mic stand with his left. A physical therapist stood behind him in case he started to fall. He wore a yellow T-shirt emblazoned with a Lion of Judah, a Rasta symbol that gave him inspiration.",The New York rock stalwart suffered a rare spinal stroke at a dinner party last year. His journey back to music has been filled with painful challenges and hope.,Arts&Leisure,2024-11-22
2024-11-22 10:00:34+00:00,Explore Your Roots: How to Plan a Family Heritage Trip,"Online tools are helping Americans travel abroad to discover their ancestry, seek out relatives and obtain documentation for dual citizenship. Here are tips for your journey.","In the second season of the TV show “The White Lotus,” three generations of a fictional American family travel to Sicily to try to reconnect with their ancestral roots. Though their journey goes hilariously wrong at times, heritage trips like theirs have become serious business.","Online tools are helping Americans travel abroad to discover their ancestry, seek out relatives and obtain documentation for dual citizenship. Here are tips for your journey.",Travel,2024-11-22
2024-11-22 10:00:34+00:00,6 Minutes. 62 People. 1 Epic ‘Sunset Boulevard’ Sequence.,"Down the stairs, out the doors and onto the sidewalk, a Broadway show hits the street. Here’s how they pull it off.","A group of young men and women, all dressed in black, marches down a busy street in the heart of Times Square. Walking in formation, they dodge parked cars, bicycles and pedestrians, as the man leading them belts out a song.","Down the stairs, out the doors and onto the sidewalk, a Broadway show hits the street. Here’s how they pull it off.",Arts&Leisure,2024-11-22
2024-11-22 10:00:52+00:00,"The World Chess Champion Could Lose His Title, and It Might Not Be Close","Chess’s biggest event starts next week. The reigning champion, Ding Liren, is seen as an underdog compared to an 18-year-old competitor.",Never has a chess world championship titleholder seemed as vulnerable.,"Chess’s biggest event starts next week. The reigning champion, Ding Liren, is seen as an underdog compared to an 18-year-old competitor.",Express,2024-11-22
