pub_date,headline,abstract,lead_paragraph,snippet,news_desk,date
2024-11-11 10:02:54+00:00,How the Tale of a Brutal Shipwreck Became a Broadway Musical,The Avett Brothers were all ears a decade ago when a determined crew of theater upstarts and veterans came aboard to adapt their maritime album for “Swept Away.”,"In the early days of the 21st century, before the Top 5 albums and the three Grammy nominations, the Avett Brothers were a band of three young guys, relentlessly touring their blend of folk-rock-country, sprinting from show to show in their van. Between gigs, Scott Avett’s father gave him a copy of “The Custom of the Sea,” Neil Hanson’s book chronicling the 19th-century wreck of the Mignonette, a British yacht, and its tragic aftermath.",The Avett Brothers were all ears a decade ago when a determined crew of theater upstarts and veterans came aboard to adapt their maritime album for “Swept Away.”,Arts&Leisure,2024-11-11
2024-11-11 10:03:05+00:00,"Caught Between Wars, Syrian Refugees in Lebanon Return Home","Hundreds of thousands of Syrians who escaped civil war at home over the past decade have now fled the conflict in Lebanon, seeking safety in their own shattered country.","When the civil war in Syria threatened his village more than a decade ago, a farmer and his family fled to neighboring Lebanon.","Hundreds of thousands of Syrians who escaped civil war at home over the past decade have now fled the conflict in Lebanon, seeking safety in their own shattered country.",Foreign,2024-11-11
2024-11-11 10:03:06+00:00,"Mortgage Rates Fell, Then Rose. What Comes Next?",Many would-be home buyers are still hoping for mortgage rates to come down as the Federal Reserve cuts interest rates. How much they will fall is unclear.,"Rafael Corrales, a real estate agent in Miami, recently showed houses to a young couple hoping to move from a rental into a home. They had been lured to the market after hearing that mortgage rates had come down.",Many would-be home buyers are still hoping for mortgage rates to come down as the Federal Reserve cuts interest rates. How much they will fall is unclear.,Business,2024-11-11
2024-11-11 10:03:32+00:00,He Dressed America. Now He Wants to Dress You.,"Aaron Levine has designed for Abercrombie & Fitch, Club Monaco and Madewell. This week, he’s introducing a brand of his own.",Aaron Levine had a pretty good idea he was going to be fired from Abercrombie & Fitch.,"Aaron Levine has designed for Abercrombie & Fitch, Club Monaco and Madewell. This week, he’s introducing a brand of his own.",Styles,2024-11-11
2024-11-11 10:03:32+00:00,The Booker Prize Is Tuesday. Which of These 6 Novels Should Win?,Percival Everett’s “James” is the favorite for the prestigious literary award. But the likes of Rachel Kushner’s “Creation Lake” or Samantha Harvey’s “Orbital” could take the prize instead.,A tale of erotic obsession that gradually becomes a story about the Holocaust. A novel set aboard a space station. A book set in a convent that experiences a plague of mice.,Percival Everett’s “James” is the favorite for the prestigious literary award. But the likes of Rachel Kushner’s “Creation Lake” or Samantha Harvey’s “Orbital” could take the prize instead.,Culture,2024-11-11
2024-11-11 10:03:40+00:00,How Do You Spell Rock Royalty? R.E.M.,"In a new biography, Peter Ames Carlin chronicles the rise of an indispensable band and the evolution of its music.","It takes a village to raise a rock band. That’s part of the premise of Peter Ames Carlin’s sensitive and well-made new biography, “The Name of This Band Is R.E.M.” The village was Athens, Ga., in the late 1970s and early ’80s, where an art and music scene thrived in the shadow of University of Georgia football.","In a new biography, Peter Ames Carlin chronicles the rise of an indispensable band and the evolution of its music.",BookReview,2024-11-11
2024-11-11 10:03:47+00:00,Army Private Is Identified Almost 80 Years After Death in World War II,Jeremiah P. Mahoney had been missing in action since 1945. His remains will be interred in Arlington National Cemetery in 2025.,"Seven months after the pivotal D-Day invasion of the French coast, a baby-faced Army private from Chicago and his anti-tank company were resupplying and reinforcing Allied forces for weeks along a 40-mile-wide front on the France-Germany border in early January 1945.",Jeremiah P. Mahoney had been missing in action since 1945. His remains will be interred in Arlington National Cemetery in 2025.,Express,2024-11-11
2024-11-11 10:03:51+00:00,"As Trump Threatens a Wider Trade War, the U.S. Confronts a Changed China","The Chinese economy is more dependent on exports, making tariffs more potent, yet it’s less reliant on American markets and increasingly bent on self-sufficiency.","Eight years ago, when a newly elected Donald J. Trump promised to apply the powers of the Oval Office to start a trade war with China, the target of his ire was widely viewed as a juggernaut. China was the indispensable factory floor to the world and a swiftly developing market for goods and services.","The Chinese economy is more dependent on exports, making tariffs more potent, yet it’s less reliant on American markets and increasingly bent on self-sufficiency.",Business,2024-11-11
2024-11-11 10:03:53+00:00,Do You Know What It Takes to Close on a New Home? Take Our Quiz.,The final step of a real estate purchase can be the most complicated.,The final step of a real estate purchase can be the most complicated.,The final step of a real estate purchase can be the most complicated.,Real Estate,2024-11-11
2024-11-11 10:03:57+00:00,The Trump Era Never Really Ended,Should we even call it a comeback?,"Bret Stephens: Hi, Gail. How are you feeling — despondent, energized, enraged, dumbstruck?",Should we even call it a comeback?,OpEd,2024-11-11
2024-11-11 10:04:06+00:00,Democrats Could Have Won. Our Excuses Mask a Devastating Reality.,"Many young voters didn’t perceive the tangible impact of their 2020 support for Joe Biden, which eroded their faith in the Democratic Party.",Inflation was too high. Turnout was too low. President Biden stayed in the race too long. His summer polling deficit was too steep to overcome.,"Many young voters didn’t perceive the tangible impact of their 2020 support for Joe Biden, which eroded their faith in the Democratic Party.",OpEd,2024-11-11
2024-11-11 10:04:07+00:00,What’s the Best Thing to Wear on a First Date?,A reader wonders if received wisdom about a certain “ideal outfit” still holds true. Our fashion critic offers a first-date fashion philosophy.,"First of all, there is no such thing as a single ideal outfit. People, of all ages, shapes, geographies and situations, are too gloriously varied. What I can offer, however, is a first-date fashion philosophy.",A reader wonders if received wisdom about a certain “ideal outfit” still holds true. Our fashion critic offers a first-date fashion philosophy.,Styles,2024-11-11
2024-11-11 10:04:39+00:00,"$865,000 Homes in California","A Queen Anne Revival-style house in Oakland, a manufactured home from 1962 in Newport Beach, and a one-bedroom condo in the Hollywood Hills.","This three-bedroom, three-bath house is in North Oakland, less than a mile from the waterfront shopping centers of Emeryville and less than two miles from the south side of Berkeley, Calif. A public library, a cocktail bar and an Ethiopian restaurant are all within a half mile, as is Temescal Creek Park. An outpost of the Berkeley Bowl market is five minutes away by car, and the campus of the University of California, Berkeley is 15 minutes away.","A Queen Anne Revival-style house in Oakland, a manufactured home from 1962 in Newport Beach, and a one-bedroom condo in the Hollywood Hills.",RealEstate,2024-11-11
2024-11-11 10:04:43+00:00,Trump and Musk: The Bromance That Cannot Last,"Now that he has been elected, Donald Trump will probably not honor the promises he made to Elon Musk.","So sorry, Elon Musk, but the bromance is not going to last. I know the president-elect put you on the phone with President Volodymyr Zelensky of Ukraine the night after the election. And I know that in Donald Trump’s victory speech, after obligatory but abbreviated nods to his “beautiful wife,” his “amazing children” and his “feisty” vice president-elect, he celebrated your super-genius as only he could, in a disjointed, discombobulated, wildly overextended paean and declaration of love. “Oh, let me tell you, we have a new star,” he said. “A star is born, Elon.”","Now that he has been elected, Donald Trump will probably not honor the promises he made to Elon Musk.",OpEd,2024-11-11
2024-11-11 10:04:49+00:00,Against Panic: A Survival Kit,"There is no cure for profound grief, but beauty and love and tenderness can walk alongside it and ease the solitude.","I had an elaborate itinerary for Election Day that I took to calling the Panic Abatement Plan. I’d walk in the woods early because temperatures are still breaking records down here. I’d stop by Parnassus Books, which would be full of kindred souls, and pick up my special order, Rachel Carson’s “The Sense of Wonder.” I’d visit the puppy room at the Nashville Humane Association. I’d have lunch with one friend, and I’d talk on the porch with another. I’d take my new book out to the yard and read while sugar maple leaves fell in golden drifts around me in the last light of day.","There is no cure for profound grief, but beauty and love and tenderness can walk alongside it and ease the solitude.",OpEd,2024-11-11
2024-11-11 11:00:03+00:00,"Wordle Review No. 1,242","Scroll down for hints and conversation about the puzzle for Nov. 12, 2024.","Welcome to The Wordle Review. Be warned: This page contains spoilers for today’s puzzle. Solve Wordle first, or scroll at your own risk.","Scroll down for hints and conversation about the puzzle for Nov. 12, 2024.",Games,2024-11-11
2024-11-11 11:00:06+00:00,The Connections Companion No. 520,"Scroll down for hints and conversation about the puzzle for Tuesday, Nov. 12, 2024.","Good morning, dear connectors. Welcome to today’s Connections forum, where you can give and receive puzzle — and emotional — support.","Scroll down for hints and conversation about the puzzle for Tuesday, Nov. 12, 2024.",Games,2024-11-11
2024-11-11 11:00:14+00:00,"Trump Transition Stalls Over Ethics Code, and a New Russian Offensive","Plus, Saudi Arabia’s “sportswashing” controversy.",On Today’s Episode:,"Plus, Saudi Arabia’s “sportswashing” controversy.",Podcasts,2024-11-11
2024-11-11 11:00:16+00:00,Democrats Search for Answers,"After their election loss, the party’s leaders are pointing fingers and wrestling with what it stands for.","Democrats, devastated by their sweeping losses in the election, are starting to sift through the wreckage of their defeat.","After their election loss, the party’s leaders are pointing fingers and wrestling with what it stands for.",Podcasts,2024-11-11
2024-11-11 11:40:27+00:00,Democrats Who Won,We’re covering this year’s successful Democratic campaigns.,"In a very bad year for their party, some Democrats still figured out how to win tough races.",We’re covering this year’s successful Democratic campaigns.,NYTNow,2024-11-11
2024-11-11 13:00:18+00:00,Israel’s Military Announces Small Expansion of Gaza Humanitarian Zone,The move comes just before a Biden administration deadline for Israel to deliver more aid to the enclave or risk a cutoff of military supplies.,Israel’s military said on Monday that it had expanded a humanitarian zone it created in southern Gaza. The move came just before the expiration of a Biden administration deadline for Israel to deliver more aid to the enclave or risk a cutoff of military supplies.,The move comes just before a Biden administration deadline for Israel to deliver more aid to the enclave or risk a cutoff of military supplies.,Foreign,2024-11-11
2024-11-11 13:04:35+00:00,A Potential Fight Over the Fed’s Future Ramps Up,"As Trump allies including Elon Musk endorse ending the Federal Reserve’s independence, the central bank’s chair is reportedly ready to go to court to fight back.","Donald Trump’s threat to exert more say over the Fed or even fire Jay Powell, the chair of the central bank, has alarmed some on Wall Street. But the president-elect’s effort took on added weight in recent days, after Elon Musk endorsed a push to erode the Fed’s independence.","As Trump allies including Elon Musk endorse ending the Federal Reserve’s independence, the central bank’s chair is reportedly ready to go to court to fight back.",Business,2024-11-11
2024-11-11 13:19:40+00:00,Trump Offers Elise Stefanik Role as U.N. Ambassador,"In one of his first cabinet-level personnel decisions, the president-elect has chosen the Republican member of Congress from New York to represent the United States at the United Nations.","President-elect Donald J. Trump has offered Representative Elise Stefanik, Republican of New York, the role of U.N. ambassador in his upcoming administration.","In one of his first cabinet-level personnel decisions, the president-elect has chosen the Republican member of Congress from New York to represent the United States at the United Nations.",Washington,2024-11-11
2024-11-11 14:00:44+00:00,Iran and Trump Are Front of Mind at Saudi Summit,Leaders from across the Arab and Muslim world were in Riyadh for a meeting officially convened to discuss the fighting in Gaza and Lebanon.,"Leaders from across the Arab world gathered on Monday in the capital of Saudi Arabia for a summit that came at a delicate moment for the kingdom, which has signaled a rapprochement with Iran after a violent, decades-long rivalry.",Leaders from across the Arab and Muslim world were in Riyadh for a meeting officially convened to discuss the fighting in Gaza and Lebanon.,Foreign,2024-11-11
2024-11-11 14:53:20+00:00,Iran Debates Whether It Could Make a Deal With Trump,"Some in Iran’s new, more moderate government think the result of the presidential election provides an opportunity to make a lasting deal with the United States.","President Donald J. Trump pulled out of the 2015 nuclear pact between Iran and world powers, imposed tough economic sanctions on Iran and ordered the killing of its top general. And Iran, federal prosecutors said on Friday, plotted to assassinate Mr. Trump before November’s election.","Some in Iran’s new, more moderate government think the result of the presidential election provides an opportunity to make a lasting deal with the United States.",Foreign,2024-11-11
2024-11-11 15:03:57+00:00,Bitcoin and Stocks Set Records as Bullish Bets Continue,"The cryptocurrency hit $88,000 and the Dow Jones industrial average reached a new high as a rally that began after Donald J. Trump’s election continued to gain steam.","Bitcoin passed $88,000 for the first time and major stock indexes set records on Monday, as markets continued to rally following Donald J. Trump’s victory in last week’s election.","The cryptocurrency hit $88,000 and the Dow Jones industrial average reached a new high as a rally that began after Donald J. Trump’s election continued to gain steam.",Business,2024-11-11
2024-11-11 15:04:18+00:00,Israel Issues New Evacuation Warnings in Lebanon,The widespread orders across southern Lebanon came amid what appeared to be intensifying efforts to reach a cease-fire.,"The Israeli military issued new evacuation warnings for more than 20 towns and villages in southern Lebanon on Monday, and Hezbollah unleashed a large rocket barrage into northern Israel, the latest indications that the conflict showed few signs of abating.",The widespread orders across southern Lebanon came amid what appeared to be intensifying efforts to reach a cease-fire.,Foreign,2024-11-11
2024-11-11 15:08:45+00:00,Jamie Oliver Pulls Children’s Book Amid Criticism of Insensitivity,"The celebrity chef’s second children’s book, “Billy and the Epic Escape,” faced accusations that it stereotyped First Nations people in Australia.",The British celebrity chef Jamie Oliver has halted sales of his children’s book around the world and issued an apology in response to accusations that the book stereotyped Australian Indigenous culture.,"The celebrity chef’s second children’s book, “Billy and the Epic Escape,” faced accusations that it stereotyped First Nations people in Australia.",Foreign,2024-11-11
2024-11-11 15:45:56+00:00,The Singular Force That Was Judith Jamison,She was always a goddess of dance — even before her triumph in “Cry.” The Ailey star turned artistic director stretched like there was no tomorrow.,The ovation lasted for almost 10 minutes. The solo that prompted it was only six minutes longer.,She was always a goddess of dance — even before her triumph in “Cry.” The Ailey star turned artistic director stretched like there was no tomorrow.,Culture,2024-11-11
2024-11-11 16:00:10+00:00,Why Trump’s Deportations Will Drive Up Your Grocery Bill,How will voters react?,"For the past few years, over and over, voters have told pollsters and pundits that they’re hopping mad about inflation. Well, we just elected a president who, if he follows through on two of his central campaign promises — across-the-board tariffs and mass deportation of undocumented immigrants — will probably cause soaring inflation.",How will voters react?,OpEd,2024-11-11
2024-11-11 16:00:10+00:00,How to Dye Your Own Hair and Not Regret It,"At-home tips from a model, an artist and a professional colorist.","“Don’t do it” is the most common advice you tend to hear about coloring your own hair. But despite all the horror stories of breakage and brassy streaks, many people embrace the challenge; once you’ve mastered the process, it’s hard to argue with the convenience and creative control. For advice, we talked to three self-taught experts: Soo Joo Park, a Los Angeles-based model known for regularly changing the color of her salon-bleached hair; Aliyah’s Interlude, an Atlanta-born music artist and TikTok star who has tried a multitude of shades on her natural hair and wigs; and Josh Wood, a British colorist whose entry into the business was dying his own hair as a teenager. The key, they say, is to know your limits and allow yourself some grace for mistakes.","At-home tips from a model, an artist and a professional colorist.",TStyle,2024-11-11
2024-11-11 16:00:20+00:00,Uranus Might Have Experienced a Freak Event When Voyager 2 Visited,"Much of the understanding of the seventh planet comes from a brief flyby nearly 40 years ago, which researchers now say overlapped with an exceptional solar event.",Our understanding of Uranus might have been all wrong for nearly 40 years.,"Much of the understanding of the seventh planet comes from a brief flyby nearly 40 years ago, which researchers now say overlapped with an exceptional solar event.",Science,2024-11-11
2024-11-11 16:00:22+00:00,Healing the Political Divide and Despair,Readers discuss the rancor and mistrust and suggest ways to come together. Also: Floods in America; support for youths; the arbitration illusion.,To the Editor:,Readers discuss the rancor and mistrust and suggest ways to come together. Also: Floods in America; support for youths; the arbitration illusion.,Letters,2024-11-11
2024-11-11 16:00:23+00:00,"Hama Amadou, West African Political ‘Phoenix,’ Dies at 74","An embattled leader for decades in Niger’s rough-and-tumble politics, he alternated stints in high office with prison and exile.","Hama Amadou, a West African politician who alternated stints in high office in Niger with prison and exile, a reflection of his country’s turbulent politics, died on Oct. 24 in Niamey, the capital. He was 74.","An embattled leader for decades in Niger’s rough-and-tumble politics, he alternated stints in high office with prison and exile.",Obits,2024-11-11
2024-11-11 16:00:24+00:00,Zhuzh Up This Risotto However You Like,"Or don’t: A bowl of classic, creamy risotto is perfect on its own.","Today seems to me like a good day to stir the pot — the risotto pot, I mean. Traditional recipes have you add broth bit by bit as you stir constantly, and even though you really need to stir it only now and then (so the rice doesn’t stick to the bottom of the pan), a session of rhythmic, gentle stirring can be just what you need at the end of a long day.","Or don’t: A bowl of classic, creamy risotto is perfect on its own.",Dining,2024-11-11
2024-11-11 16:07:35+00:00,The Trump Insiders Who Have Outsize Influence as He Chooses His Cabinet,Aides like Susie Wiles and advisers like Elon Musk are weighing in as the president-elect shapes his new administration.,"President-elect Donald J. Trump has been known to cast a wide net when seeking advice for hiring decisions. As his team ramps up the presidential transition process, Mr. Trump is calling friends and associates for input on who should be part of his administration, which he says will radically reshape the federal government.",Aides like Susie Wiles and advisers like Elon Musk are weighing in as the president-elect shapes his new administration.,Washington,2024-11-11
2024-11-11 17:00:08+00:00,Paul Mescal Rides ‘A Streetcar Named Desire’ to Brooklyn,The award-winning production will begin performances in February as part of Brooklyn Academy of Music’s next season.,"Brooklyn Academy of Music next spring will present an Olivier Award-winning revival of “A Streetcar Named Desire” starring Paul Mescal, the Irish actor, in the role made famous by Marlon Brando.",The award-winning production will begin performances in February as part of Brooklyn Academy of Music’s next season.,Culture,2024-11-11
2024-11-11 17:17:08+00:00,Trump Transition Signals Focus on Deportations as Miller Assumes Influence,President-elect Donald Trump is expected to name the immigration hard-liner Stephen Miller as deputy chief of staff and announced a former ICE official as his “border czar.”,President-elect Donald J. Trump is signaling with his staffing decisions his intention to carry out a campaign promise of widespread deportations of undocumented immigrants and tightening of measures that allow some of them to stay in the country legally.,President-elect Donald Trump is expected to name the immigration hard-liner Stephen Miller as deputy chief of staff and announced a former ICE official as his “border czar.”,Washington,2024-11-11
2024-11-11 17:58:30+00:00,Netanyahu Seeks to Delay Testifying at His Corruption Trial,"Benjamin Netanyahu, the Israeli prime minister, is on trial for bribery and fraud. Now he wants to delay giving testimony.","Prime Minister Benjamin Netanyahu of Israel has requested to delay testifying at his ongoing corruption trial, fueling criticism that he is seeking to drag out the case in order to delay a verdict and, if convicted, a jail term.","Benjamin Netanyahu, the Israeli prime minister, is on trial for bribery and fraud. Now he wants to delay giving testimony.",Foreign,2024-11-11
2024-11-11 18:06:05+00:00,"Lou Donaldson, Soulful Master of the Alto Saxophone, Dies at 98","A player of impeccable technique and a mainstay of the Blue Note label, he recorded constantly as both a leader and a sideman beginning in 1952.","Lou Donaldson, an alto saxophonist who became part of the bedrock of the jazz scene and whose soulful, blues-steeped presence in the music endured undiminished for three-quarters of a century, died on Saturday. He was 98.","A player of impeccable technique and a mainstay of the Blue Note label, he recorded constantly as both a leader and a sideman beginning in 1952.",Obits,2024-11-11
2024-11-11 18:13:52+00:00,"What to Know About Elise Stefanik, Trump’s Pick for U.N. Ambassador","Ms. Stefanik, who chairs the House Republican Conference, undertook a dramatic transformation that brought her to the center of Donald J. Trump’s orbit.","Representative Elise Stefanik of New York has been one of President-elect Donald J. Trump’s most ferocious allies for years, defending him during his two impeachments, amplifying his lies about the 2020 election and rallying behind his comeback campaign.","Ms. Stefanik, who chairs the House Republican Conference, undertook a dramatic transformation that brought her to the center of Donald J. Trump’s orbit.",Metro,2024-11-11
2024-11-11 18:20:39+00:00,Review: A Superficial Take on Migration as Movement,"At the Brooklyn Academy of Music, the highlight of Dana Gingras’s “Frontera” may well be the lighting design.","Migration is among the most consequential of global forces. As a subject manifest in the movement of bodies, it seems especially suited for dance to address, and that is what “Frontera,” a work by the Canadian choreographer Dana Gingras, promises.","At the Brooklyn Academy of Music, the highlight of Dana Gingras’s “Frontera” may well be the lighting design.",Culture,2024-11-11
2024-11-11 18:58:41+00:00,California Counts Methodically as House Control Hangs in the Balance,Nine of the 16 races that will determine which party controls the House of Representatives are in California. No state takes longer to tally votes.,The nation is again waiting on California to finish tallying votes almost a week after Election Day.,Nine of the 16 races that will determine which party controls the House of Representatives are in California. No state takes longer to tally votes.,National,2024-11-11
