pub_date,headline,abstract,lead_paragraph,snippet,news_desk,date
2024-11-11 19:30:16+00:00,Why Was There a Broad Drop-Off in Democratic Turnout in 2024?,"Many Democrats failed to turn out to vote at the rate they did in 2020 when they ousted Donald Trump, according to an analysis of election data.","Voters in liberal strongholds across the country, from city centers to suburban stretches, failed to show up to vote for Vice President Kamala Harris at the levels they had for Joseph R. Biden Jr. four years earlier, contributing significantly to her defeat by Donald J. Trump, according to a New York Times analysis of preliminary election data.","Many Democrats failed to turn out to vote at the rate they did in 2020 when they ousted Donald Trump, according to an analysis of election data.",Politics,2024-11-11
2024-11-11 19:42:06+00:00,Spirit Airlines Plane Hit by Gunfire in Haiti and Forced to Divert,"A day after the prime minister of Haiti was fired, the airport in Port-au-Prince was closed because of the attack on the aircraft. A JetBlue plane was also struck.","A Spirit Airlines flight attempting to land in Port-au-Prince, Haiti, was shot at on Monday and forced to divert, marking a sharp escalation in the violence that has gripped the nation.","A day after the prime minister of Haiti was fired, the airport in Port-au-Prince was closed because of the attack on the aircraft. A JetBlue plane was also struck.",Foreign,2024-11-11
2024-11-11 20:00:04+00:00,Why Do So Many Americans Pass Up Bigger Social Security Checks?,It shouldn’t be so easy to leave benefits on the table.,"People get just 70 percent of their full Social Security benefit if they claim at 62, the full benefit at 67 and 124 percent of the benefit if they claim at 70. The gain from waiting is so big that it pays for most people to keep working,or even to dip deep into their retirement savings early to cover their expenses so they can delay claiming.",It shouldn’t be so easy to leave benefits on the table.,OpEd,2024-11-11
2024-11-11 20:10:44+00:00,Bishop Calls on Anglican Leader to Quit Over Handling of Abuse Scandal,"An independent report last week said that the Most Rev. Justin Welby, the archbishop of Canterbury, took insufficient action after learning of alleged abuse decades ago at Christian summer camps.","A Church of England bishop on Monday called for the resignation of the archbishop of Canterbury, the Most Rev. Justin Welby, days after a report concluded that he had failed to ensure a proper investigation into claims of sadistic abuse decades ago at Christian summer camps.","An independent report last week said that the Most Rev. Justin Welby, the archbishop of Canterbury, took insufficient action after learning of alleged abuse decades ago at Christian summer camps.",Foreign,2024-11-11
2024-11-11 20:24:13+00:00,Indiana Man Convicted of Killing 2 Girls After Video Found on Victim’s Phone,"A jury on Monday found Richard Allen guilty of killing Liberty German and Abigail Williams, who were on a hike in 2017. Video showed a man following the girls.","An Indiana man was found guilty on Monday of killing two girls on a wooded trail in 2017 in a case that garnered national attention, spawned podcasts and riveted true-crime fans drawn to the case’s twists and turns.","A jury on Monday found Richard Allen guilty of killing Liberty German and Abigail Williams, who were on a hike in 2017. Video showed a man following the girls.",Express,2024-11-11
2024-11-11 20:27:38+00:00,Biden Honors Veterans in Ceremony at Arlington Cemetery,"“This is the last time I will stand here at Arlington as commander in chief,” President Biden said in remembering service members who have served the country.","President Biden urged Americans to take a moment to honor those who serve in the military and their families on Monday, using the backdrop of Arlington National Cemetery to observe Veterans Day one last time as the country’s commander in chief.","“This is the last time I will stand here at Arlington as commander in chief,” President Biden said in remembering service members who have served the country.",Washington,2024-11-11
2024-11-11 20:33:35+00:00,Former Staten Island Representative Is Paralyzed After Fall From Horse,"Michael Grimm, a Republican who resigned in 2015 after pleading guilty to felony tax evasion, was paralyzed from the chest down during a polo competition in September.","Michael Grimm, a former U.S. representative from Staten Island, was paralyzed after a fall from a horse during a polo competition in September. The condition of Mr. Grimm, a Republican and former F.B.I. agent and Marine who resigned from Congress in 2015 and served seven months in prison for tax fraud, was first reported by a colleague from Newsmax, where Mr. Grimm had found a second career as an on-air personality.","Michael Grimm, a Republican who resigned in 2015 after pleading guilty to felony tax evasion, was paralyzed from the chest down during a polo competition in September.",Metro,2024-11-11
2024-11-11 21:09:30+00:00,Tuesday Briefing: Trump Starts Building His Cabinet,"Plus, West African fine dining.",President-elect Donald Trump is making decisions about his administration. ,"Plus, West African fine dining.",NYTNow,2024-11-11
2024-11-11 21:23:18+00:00,Trump Chooses Lee Zeldin to Run E.P.A. as He Plans to Gut Climate Rules,The former congressman from New York is a strong supporter of Donald Trump and voted against certifying the 2020 election.,"President-elect Donald J. Trump announced on Monday that he would nominate former Representative Lee Zeldin, Republican of New York, to lead the Environmental Protection Agency, a position that is expected to be central to Mr. Trump’s plans to dismantle landmark climate regulations.",The former congressman from New York is a strong supporter of Donald Trump and voted against certifying the 2020 election.,Climate,2024-11-11
2024-11-11 21:35:19+00:00,"Trump Plans Series of Executive Orders for Day 1, Susie Wiles Tells Donors","Ms. Wiles, the next White House chief of staff, said Donald Trump would move quickly to reinstate orders from his first term that President Biden had revoked, though she did not specify which ones.","Susie Wiles, the next White House chief of staff, privately told a group of Republican donors on Monday that President-elect Donald J. Trump would move on his first day in office to reinstate several executive orders from Mr. Trump’s first term that President Biden had revoked, according to two people in the room who insisted on anonymity to describe the closed-door remarks.","Ms. Wiles, the next White House chief of staff, said Donald Trump would move quickly to reinstate orders from his first term that President Biden had revoked, though she did not specify which ones.",Politics,2024-11-11
2024-11-11 22:00:10+00:00,"As the Pandemic Deepened, Americans Kept Drinking More","Excessive drinking persisted in the years after Covid arrived, according to new data.","Americans started drinking more as the Covid-19 pandemic got underway. They were stressed, isolated, uncertain — the world as they had known it had changed overnight.","Excessive drinking persisted in the years after Covid arrived, according to new data.",Science,2024-11-11
2024-11-11 22:58:59+00:00,New York Times Tech Guild Ends Strike,"The union said its members would return to work on Tuesday, even though it had not yet reached a contract deal with the company.","The Times Tech Guild, which represents more than 600 tech workers at The New York Times, announced on Monday that it had ended its weeklong strike despite not reaching a deal on a contract.","The union said its members would return to work on Tuesday, even though it had not yet reached a contract deal with the company.",Business,2024-11-11
2024-11-11 23:01:44+00:00,Amsterdam Police Arrest 5 More Men Over Antisemitic Attacks,"A total of eight people were being held in connection with last week’s violence, and unrest in the largest city in the Netherlands continued on Monday night.","The police in Amsterdam arrested five more people on assault charges this weekend, four of whom are still being held, over the attacks on Israeli soccer fans in the city late last week after a match between an Israeli and a Dutch team.","A total of eight people were being held in connection with last week’s violence, and unrest in the largest city in the Netherlands continued on Monday night.",Foreign,2024-11-11
2024-11-11 23:06:19+00:00,Murder Suspect Who Alleged Bear Attack Is Captured in South Carolina,"The suspect was taken into custody, ending a multistate manhunt in a case involving a suspicious emergency call, a false identity and a fake bear attack.","Law enforcement officials have captured a man who was wanted for murder in rural Tennessee, ending a multistate manhunt in a bizarre case involving a suspicious emergency call, a false identity and a fake bear attack.","The suspect was taken into custody, ending a multistate manhunt in a case involving a suspicious emergency call, a false identity and a fake bear attack.",Express,2024-11-11
2024-11-11 23:15:03+00:00,Democrats Pick Up Seat in Newly Drawn Louisiana District,"Cleo Fields, a longtime Baton Rouge politician, won more than 50 percent of the vote in an open primary, negating the need for a runoff.","Democrats have picked up a seat with victory in Louisiana’s newly drawn Sixth Congressional District, according to The Associated Press.","Cleo Fields, a longtime Baton Rouge politician, won more than 50 percent of the vote in an open primary, negating the need for a runoff.",National,2024-11-11
2024-11-11 23:35:24+00:00,"Remembering Quincy Jones, a Bridge Between Genres and Generations","A conversation about his long and unique footprint in music, and how he discussed it later in his career.","Early this month, Quincy Jones, one of the most influential and creative forces in American pop music history, died at 91. The scope of his success almost defies comprehension — his work began in the 1950s and continued all the way up through recent years. He produced the most important Michael Jackson albums, and also Frank Sinatra, and also “We Are the World.” He won 28 Grammys. Sarah Vaughan, Miles Davis, Usher, the Weeknd, Lionel Hampton, “The Fresh Prince of Bel-Air,”: He crossed paths with all of them, and more.","A conversation about his long and unique footprint in music, and how he discussed it later in his career.",Culture,2024-11-11
2024-11-11 23:40:55+00:00,I.C.C. Prosecutor Seeking Arrest of Israeli Leaders Faces Own Inquiry,"The International Criminal Court said there will be an investigation into sexual misconduct allegations against Karim Khan, the court’s chief prosecutor.","The International Criminal Court will commission an independent investigation into accusations of sexual misconduct by its chief prosecutor, the court announced Monday.","The International Criminal Court said there will be an investigation into sexual misconduct allegations against Karim Khan, the court’s chief prosecutor.",Foreign,2024-11-11
