pub_date,headline,abstract,lead_paragraph,snippet,news_desk,date
2024-11-22 10:00:53+00:00,Jon M. Chu Waited 20 Years for the Chance to Direct ‘Wicked’,He never doubted it would work as a movie. He just hoped he would be the one to film it: “I have my own experiences with being green.”,"On a recent morning, Jon M. Chu was in his office in the Toluca Lake neighborhood of Los Angeles, describing what it was like to direct “Defying Gravity,” the thrilling finale of his forthcoming adaptation of “Wicked.” In the Broadway version of the scene, the green-hued Elphaba, a.k.a. the Wicked Witch of the West, rises above the stage atop a huge platform, its mechanical guts hidden behind an enormous black cape. Onstage, the effect is showstopping.",He never doubted it would work as a movie. He just hoped he would be the one to film it: “I have my own experiences with being green.”,Arts&Leisure,2024-11-22
2024-11-22 10:01:06+00:00,"For a Raw Portrait of War, Look to Palestinian Poets","In their new collections, Mosab Abu Toha and Najwan Darwish share unvarnished views of destruction, displacement and loss.","Mosab Abu Toha held his hands six inches apart to demonstrate the flattening of his home in Gaza on Oct. 28, 2023.","In their new collections, Mosab Abu Toha and Najwan Darwish share unvarnished views of destruction, displacement and loss.",Books,2024-11-22
2024-11-22 10:01:06+00:00,Two Picture Books That Set the Table for an Object Lesson,Sometimes a spoon is just a spoon.,"The spoon’s best-known role in the annals of children’s literature is as the dish’s paramour. But the spoon can be more than a consort. In Amy Krause Rosenthal’s classic tale of identity crisis, the titular implement has thoughts and feelings. (Spoon wants to be a fork.) It is exceedingly rare, however, for this most well-rounded of utensils to be considered not a character with agency but an object to use — you know, like a spoon. In part that’s because we tend to remake everything in our own image, as if it’s somehow comforting — rather than terrifying — to think of spoons (and sausages and scissors and seeds) as sentient. It’s also infinitely more difficult to craft a narrative around a soulless, spoony spoon: humble, edgeless, concave, mute.",Sometimes a spoon is just a spoon.,BookReview,2024-11-22
2024-11-22 10:01:44+00:00,The Complexities of Fighting for Democracy,"“Night Is Not Eternal,” which follows the Cuban activist Rosa María Payá, is the rare nuanced political documentary that is likely to challenge every viewer’s perspective.","If you’ve watched a lot of political documentaries, especially those that deal with American politics, I think you’ll agree with me on this: Many, if not most, are overly simplistic. It’s just hard to explain the current social and cultural moment, or adequately chronicle the rise of a controversial figure, in a couple of hours. Most often I find they fall along ideological lines with easy answers, rarely challenging partisan orthodoxies or prodding the viewer into new mental territory.","“Night Is Not Eternal,” which follows the Cuban activist Rosa María Payá, is the rare nuanced political documentary that is likely to challenge every viewer’s perspective.",Culture,2024-11-22
2024-11-22 10:01:58+00:00,Let’s End This Turkey Pardoning Nonsense,President Biden should cancel the Thanksgiving tradition of pardoning a turkey.,"Someone at the National Turkey Federation once had an idea: Let’s send a live turkey to Harry Truman for a presidential holiday feast! Previously, some individual turkey producers had sent their products to the president to promote them, but the greater resources of the National Turkey Federation meant that the story could be promoted more effectively.",President Biden should cancel the Thanksgiving tradition of pardoning a turkey.,OpEd,2024-11-22
2024-11-22 10:01:59+00:00,Inside the Deadliest Job in America,Logging has long been a way of life for rural communities in the Pacific Northwest and South. It also comes with grave risk.,"Mostly employed in densely forested pockets of the Pacific Northwest and the South, loggers have the highest rate of fatal on-the-job injuries of any civilian occupation in the nation, outpacing roofers, hunters and underground mining machine operators.",Logging has long been a way of life for rural communities in the Pacific Northwest and South. It also comes with grave risk.,Business,2024-11-22
2024-11-22 10:02:01+00:00,"$650,000 Homes in Normandy, France","A renovated thatched-roof cottage, a stone house with a glass pavilion, and a restored 19th-century fisherman’s cottage in Villerville.","Made of mud and straw, the thatched roof atop this four-bedroom, one-bathroom cottage is designed to retain heat during winter and to cool the interiors in the summer. The sellers, a couple from the south of France, bought the 1970s house from a French architect who completed an extensive renovation in 2022.","A renovated thatched-roof cottage, a stone house with a glass pavilion, and a restored 19th-century fisherman’s cottage in Villerville.",RealEstate,2024-11-22
2024-11-22 10:02:08+00:00,"Twists and Turns in Sept. 11 Plea Process Are Agonizing, Families Say","No matter whether they prefer a trial or swift resolution, relatives of victims of the attacks consider the on-again, off-again plea deal to be cruel.","Families of the nearly 3,000 victims of the Sept. 11, 2001, attacks may be divided over whether the man accused of being the mastermind of the plot should someday face a death penalty trial or be allowed to plead guilty in exchange for life in prison.","No matter whether they prefer a trial or swift resolution, relatives of victims of the attacks consider the on-again, off-again plea deal to be cruel.",Washington,2024-11-22
2024-11-22 10:02:17+00:00,The Flag That Covered Lincoln’s Coffin Goes Up for Auction,"The Museum of Southern History in Florida is selling the flag, which will be auctioned off by Guernsey’s, along with other Lincoln memorabilia.",Good morning. Today we’ll look at the flag that covered Abraham Lincoln’s coffin on the funeral train in 1865. It is on the auction block in New York. We’ll also get details on a major housing plan that is now headed for a vote by the full City Council.,"The Museum of Southern History in Florida is selling the flag, which will be auctioned off by Guernsey’s, along with other Lincoln memorabilia.",Metro,2024-11-22
2024-11-22 10:02:21+00:00,"Facing 8 Years in Prison, a Director Flees Iran",Mohammad Rasoulof had to make the most difficult decision of his life.,"In the early months of 2024, a few weeks into the shooting of his new film, “The Seed of the Sacred Fig,” Mohammad Rasoulof learned that his lawyers received a letter. Iran’s Islamic Revolutionary Court had processed his case, composed of several charges against his previous movies and activism, and sentenced him to eight years in prison. Rasoulof asked his lawyers how much time he had before the authorities took him in. The process of filing an appeal, they told him, could take up to two months. He still had some time.",Mohammad Rasoulof had to make the most difficult decision of his life.,Magazine,2024-11-22
2024-11-22 10:02:23+00:00,How Saudi Arabia Is Stalling Global Climate Talks,"Despite endorsing a transition away from fossil fuels last year, Saudi Arabia has since worked to undermine it, diplomats say. Lisa Friedman, a New York Times reporter covering climate policy and politics, describes how the opposition is unlike anything climate negotiators say they’ve seen before.","Despite endorsing a transition away from fossil fuels last year, Saudi Arabia has since worked to undermine it, diplomats say. Lisa Friedman, a New York Times reporter covering climate policy and politics, describes how the opposition is unlike anything climate negotiators say they’ve seen before.","Despite endorsing a transition away from fossil fuels last year, Saudi Arabia has since worked to undermine it, diplomats say. Lisa Friedman, a New York Times reporter covering climate policy and politics, describes how the opposition is unlike an...",,2024-11-22
2024-11-22 10:02:28+00:00,We Wanted a ‘Grand New Party.’ Trump Delivered.,Ross Douthat and Reihan Salam had a vision for how Republicans could reclaim the working class. They never expected Trump to fulfill it.,"On this episode of “Matter of Opinion,” Ross Douthat is joined by his good friend Reihan Salam, a former housemate and co-author and the president of the Manhattan Institute. As young conservatives, the two teamed up in the waning days of the George W. Bush era to write “Grand New Party: How Republicans Can Win the Working Class and Save the American Dream.”",Ross Douthat and Reihan Salam had a vision for how Republicans could reclaim the working class. They never expected Trump to fulfill it.,OpEd,2024-11-22
2024-11-22 10:02:33+00:00,How a Tale of Sean Combs Sex Tapes Landed One Man in Court,"Courtney Burgess, a one-time music industry bit player, said he had videos showing encounters involving celebrities. Prosecutors recently subpoenaed him.","In federal court, the music mogul Sean Combs is facing a sweeping indictment that accuses him of running a criminal enterprise that engaged in sex trafficking and racketeering conspiracy.","Courtney Burgess, a one-time music industry bit player, said he had videos showing encounters involving celebrities. Prosecutors recently subpoenaed him.",Culture,2024-11-22
2024-11-22 10:02:35+00:00,"Trump Gained 95,000 Votes in New York City. Democrats Lost Half a Million.","In every neighborhood in New York City, from Red Hook in Brooklyn to Riverdale in the Bronx, Vice President Kamala Harris received markedly fewer votes than Joseph R. Biden, Jr., did in 2020, while in most neighborhoods, Donald J. Trump notched modest increases.","In every neighborhood in New York City, from Red Hook in Brooklyn to Riverdale in the Bronx, Vice President Kamala Harris received markedly fewer votes than Joseph R. Biden, Jr., did in 2020, while in most neighborhoods, Donald J. Trump notched modest increases.","In every neighborhood in New York City, from Red Hook in Brooklyn to Riverdale in the Bronx, Vice President Kamala Harris received markedly fewer votes than Joseph R. Biden, Jr., did in 2020, while in most neighborhoods, Donald J. Trump notched mo...",Graphics,2024-11-22
2024-11-22 10:02:37+00:00,"The High Risk, High Reward Trump Market","Faced with unconventional and disruptive proposals, investors are figuring out how to place their bets.","Markets abhor uncertainty. That bit of Wall Street wisdom helps explain their ebb and flow since Donald J. Trump’s victory on Election Day, and even earlier.","Faced with unconventional and disruptive proposals, investors are figuring out how to place their bets.",SundayBusiness,2024-11-22
2024-11-22 10:02:57+00:00,"Creating New Cinematic Languages, Without Words",“Flow” is the latest dialogue-free animated film to look to movement and sound to express its characters’ emotions.,"Like Noah’s Ark minus the humans, a vessel carrying an odd bunch of creatures is afloat after a flood in the immersive computer-animated film “Flow.” Led by a black cat, the group faces the dangers of nature together, often struggling to get along yet communicating entirely without dialogue.",“Flow” is the latest dialogue-free animated film to look to movement and sound to express its characters’ emotions.,Culture,2024-11-22
2024-11-22 10:02:57+00:00,The Fleeting Comforts of the Celebrity Look-Alike Contest,The culture-wide search for doubles of famous men is an election-season gift: an apolitical democratic event where — for a brief moment — everybody wins.,"It may be a coincidence that the celebrity look-alike competition returned to prominence just as American citizens were voting in what some called “the most significant presidential election in our lifetimes.” But once it happened, the appeal was obvious. Here was a different kind of democratic event: a totally insignificant one, in which attractive men with slightly off-kilter features were lined up in public and ranked by the roaring crowd.",The culture-wide search for doubles of famous men is an election-season gift: an apolitical democratic event where — for a brief moment — everybody wins.,Culture,2024-11-22
2024-11-22 10:03:01+00:00,9 New Movies Our Critics Are Talking About This Week,"Whether you’re a casual moviegoer or an avid buff, our reviewers think these films are worth knowing about.","At a magical university, two witches — Glinda and Elphaba — meet and become unlikely friends in this musical directed by Jon M. Chu, the first installment in a two-part adaptation of the Broadway show.","Whether you’re a casual moviegoer or an avid buff, our reviewers think these films are worth knowing about.",Culture,2024-11-22
2024-11-22 10:03:01+00:00,6 New Documentaries Our Critics Are Talking About This Week,"Whether you’re a casual viewer or certified fan of the genre, our reviewers think these documentaries are worth knowing about.","Rachel Elizabeth Seed’s mother, Sheila Turner Seed, died when she was 42 and Rachel was 18 months old. In this documentary, she seeks to connect with her mother through her photography.","Whether you’re a casual viewer or certified fan of the genre, our reviewers think these documentaries are worth knowing about.",Culture,2024-11-22
2024-11-22 10:03:05+00:00,Liberals Bet They Could Beat Trump With the Law. They Lost.,A few victories made it easy for Democrats to forget that the law is just another domain of politics where their enemies enjoy power too.,The yearslong effort to vanquish Donald Trump in court was a dismal failure.,A few victories made it easy for Democrats to forget that the law is just another domain of politics where their enemies enjoy power too.,OpEd,2024-11-22
2024-11-22 10:03:18+00:00,Why Trump Allies Say Immigration Hurts American Workers,JD Vance and others on the “new right” say limiting immigration will raise wages and give jobs to sidelined Americans. Many studies suggest otherwise.,"As President-elect Donald J. Trump’s second administration takes shape, his plans for a signature campaign promise are becoming clear: mass deportations of undocumented immigrants, including new detention centers, workplace raids and possibly the mobilization of the military to aid in expulsions.",JD Vance and others on the “new right” say limiting immigration will raise wages and give jobs to sidelined Americans. Many studies suggest otherwise.,Business,2024-11-22
2024-11-22 10:03:19+00:00,"This Beer Is Made From Sewage. And at the Climate Summit, That’s OK.","The hoppy pilsner from Singapore, where freshwater is scarce, is part of an effort to promote recycling solutions.","Food and drink, the fuel that keeps negotiators negotiating and reporters reporting, always gets a lot of attention at climate summits.","The hoppy pilsner from Singapore, where freshwater is scarce, is part of an effort to promote recycling solutions.",Climate,2024-11-22
2024-11-22 10:03:31+00:00,Will This Poem Find Life in Outer Space?,"Together, NASA and the U.S. poet laureate Ada Limón bring a little bit of humanity to the second moon of Jupiter.","On Oct. 14, 2024, the Europa Clipper, the largest interplanetary spacecraft NASA has ever built, launched into the cosmos. If all goes according to plan, over five and a half years, the probe, which has no crew, will travel 1.8 billion miles to see if the watery landscape beneath the icy crust of Jupiter’s second moon, Europa, might be conducive to life. In other words, this mission has the potential to change humanity’s understanding of our place in the solar system.","Together, NASA and the U.S. poet laureate Ada Limón bring a little bit of humanity to the second moon of Jupiter.",Podcasts,2024-11-22
2024-11-22 10:03:34+00:00,The Tallest Building in Queens Rises in Long Island City,"The Orchard, a rental tower with a dizzying array of luxury amenities, caps a decade of rapid development in the neighborhood.","The Orchard is set to be the tallest building in Queens, after topping out at 823 feet this summer. The amenity-rich rental tower in Long Island City is expected to open in early 2026, with 824 units, a third of which will be designated as affordable housing.","The Orchard, a rental tower with a dizzying array of luxury amenities, caps a decade of rapid development in the neighborhood.",RealEstate,2024-11-22
2024-11-22 10:03:43+00:00,"What Green, Yellow and Red Flags Do You Look For When It Comes to Dating?","What behaviors or actions from a potential partner tell you to go ahead, slow down or hit the brakes?",Imagine you have started dating someone new. What signs might you see that would tell you to keep going out with this person? What signs would tell you to hit the brakes?,"What behaviors or actions from a potential partner tell you to go ahead, slow down or hit the brakes?",Learning,2024-11-22
2024-11-22 10:03:50+00:00,The ‘Landslide’ That Wasn’t: Trump and Allies Pump Up His Narrow Victory,The latest vote count shows that Donald J. Trump won the popular vote by one of the smallest margins since the 19th century. But Mr. Trump claims a “powerful mandate.”,"On the night he won a second term, President-elect Donald J. Trump rejoiced in the moment. “America has given us an unprecedented and powerful mandate,” he boasted. In the two and a half weeks since, his campaign has repeatedly heralded his “landslide,” even to market Trump merchandise like the “Official Trump Victory Glass.”",The latest vote count shows that Donald J. Trump won the popular vote by one of the smallest margins since the 19th century. But Mr. Trump claims a “powerful mandate.”,Washington,2024-11-22
2024-11-22 10:03:50+00:00,"In This House, We’re Angry When Government Fails",The Democratic Party needs to rethink what it means to be the party of institutions.,"In any political moment, where the rage collects, where the opposition rallies tells you a lot. Behind Matt Gaetz, the liberals I know have been far angrier about the choice of Robert F. Kennedy Jr. to lead the Department of Health and Human Services than any of Donald Trump’s other picks.",The Democratic Party needs to rethink what it means to be the party of institutions.,OpEd,2024-11-22
2024-11-22 10:03:52+00:00,"The New York Times News Quiz, Nov. 22, 2024",Did you follow the news this week? Take our quiz to see how well you stack up with other Times readers.,Did you follow the news this week? Take our quiz to see how well you stack up with other Times readers.,Did you follow the news this week? Take our quiz to see how well you stack up with other Times readers.,Briefing,2024-11-22
2024-11-22 10:03:57+00:00,Will Musk Be the Death of NASA?,"SpaceX is on top right now, and, presumably, Musk wants to keep it that way.","Donald Trump recently asked Elon Musk and Vivek Ramaswamy to head what he called the Department of Government Efficiency, or DOGE, an unofficial initiative for reducing the size of the federal government. It’s not going to be a real department, but its informal advice could guide the budget-cutters at the White House and in Congress.","SpaceX is on top right now, and, presumably, Musk wants to keep it that way.",OpEd,2024-11-22
2024-11-22 10:04:04+00:00,This House Democrat Keeps Winning in Trump Country. Here’s What She Knows.,Lessons from a Democratic winner in Trump country.,"I first met Marie Gluesenkamp Perez in 2022, when she was running what was widely seen as a long-shot Democratic campaign for Congress in a solidly Republican, heavily rural part of Washington State. Shortly before the election, the polling aggregator FiveThirtyEight estimated her chance of victory at a mere 2 percent. But she won, defeating a burgeoning star of the MAGA movement named Joe Kent.",Lessons from a Democratic winner in Trump country.,OpEd,2024-11-22
2024-11-22 10:04:05+00:00,Trump’s Crown Doesn’t Fit,The Constitution is not a grant of power for a king.,The Constitution is not a grant of power for a king.,The Constitution is not a grant of power for a king.,OpEd,2024-11-22
2024-11-22 10:04:08+00:00,How to Avoid Awkward Holiday Conversations,All you need is 30 seconds to prep.,"I’m hosting Thanksgiving for my extended family this year, and I want it to be restorative and fun.",All you need is 30 seconds to prep.,Well,2024-11-22
2024-11-22 10:27:01+00:00,"‘This Helps Netanyahu’: Israelis Rally Around Leader Over Warrant, for Now","An I.C.C. arrest warrant for Prime Minister Benjamin Netanyahu over the war in Gaza spurred outrage across Israel’s political spectrum. But in the long term, it’s not a good look for a prime minister.","The more Prime Minister Benjamin Netanyahu of Israel is cast as an international pariah, the more many Israelis appear to embrace him.","An I.C.C. arrest warrant for Prime Minister Benjamin Netanyahu over the war in Gaza spurred outrage across Israel’s political spectrum. But in the long term, it’s not a good look for a prime minister.",Foreign,2024-11-22
2024-11-22 11:00:02+00:00,Wordle Review No. 1253,"Scroll down for hints and conversation about the puzzle for Saturday, Nov. 23, 2024.","Welcome to The Wordle Review. Be warned: This page contains spoilers for today’s puzzle. Solve Wordle first, or scroll at your own risk.","Scroll down for hints and conversation about the puzzle for Saturday, Nov. 23, 2024.",Games,2024-11-22
2024-11-22 11:00:03+00:00,The Connections Companion No. 531,"Scroll down for hints and conversation about the puzzle for Saturday, Nov. 23, 2024.","Good morning, dear connectors. Welcome to today’s Connections forum, where you can give and receive puzzle — and emotional — support.","Scroll down for hints and conversation about the puzzle for Saturday, Nov. 23, 2024.",Games,2024-11-22
2024-11-22 11:00:09+00:00,"Trump’s New Pick for Attorney General, and a Surprise Turn in U.S. Drug Deaths","Plus, a “Wicked” warning.",On Today’s Episode:,"Plus, a “Wicked” warning.",Podcasts,2024-11-22
2024-11-22 11:00:13+00:00,Matt Gaetz Calls It Quits,President-elect Donald Trump’s first pick for attorney general had faced scrutiny after allegations of sexual misconduct and drug use.,"After just nine days as Donald Trump’s pick for attorney general, Matt Gaetz has withdrawn from consideration.",President-elect Donald Trump’s first pick for attorney general had faced scrutiny after allegations of sexual misconduct and drug use.,Podcasts,2024-11-22
2024-11-22 11:29:48+00:00,"As Ukraine Fires U.S. Missiles, Putin Sends a Chilling Message",The Russian leader ominously declares that America risks nuclear war as it expands its aid.,"In many ways, President Vladimir V. Putin seems to be winning.",The Russian leader ominously declares that America risks nuclear war as it expands its aid.,Foreign,2024-11-22
2024-11-22 11:38:26+00:00,"Ukraine Cancels Parliament Session, Citing a Warning Over a Missile Attack",This is the first time Parliament has canceled a session since Russia invaded Ukraine.,"Ukraine’s Parliament canceled a session on Friday over a warning that Russia could target the building in an attack with a missile that Ukraine’s air defenses cannot shoot down, lawmakers said.",This is the first time Parliament has canceled a session since Russia invaded Ukraine.,Foreign,2024-11-22
2024-11-22 11:43:13+00:00,Changes in New York City,How city and state officials are trying to make the city more livable.,"New York City faces an affordability crisis. Rents have soared. The century-old subway needs to be modernized, and buses are painfully slow. Piles of trash bags often line the sidewalks. The person tasked with fixing these problems, Mayor Eric Adams, faces a major corruption scandal.",How city and state officials are trying to make the city more livable.,NYTNow,2024-11-22
2024-11-22 11:44:45+00:00,Israel Strikes Across Lebanon After Ordering Evacuations of Southern Towns,The wide-scale bombardment continued a day after a U.S. envoy held talks with Israeli officials on a possible cease-fire with Hezbollah militants.,"Israel pressed on with its bombardment of Lebanon on Friday after issuing widespread evacuation warnings in the country’s south, as its conflict with Hezbollah militants showed no sign of abating despite a U.S.-led push for a cease-fire.",The wide-scale bombardment continued a day after a U.S. envoy held talks with Israeli officials on a possible cease-fire with Hezbollah militants.,Foreign,2024-11-22
2024-11-22 11:50:52+00:00,"Russia Supplies Antiaircraft Missiles to North Korea, South Korea Says",Pyongyang has long coveted an advanced air-defense system to guard against missiles and war planes from the United States and South Korea.,"Russia has supplied North Korea with antiaircraft missiles in return for the deployment of its troops ​to fight in Russia’s war against Ukraine, South Korea’s national security adviser said on Friday.​",Pyongyang has long coveted an advanced air-defense system to guard against missiles and war planes from the United States and South Korea.,Foreign,2024-11-22
