pub_date,headline,abstract,lead_paragraph,snippet,news_desk,date
2024-11-11 00:22:38+00:00,"Bruce Degen, Who Drew ‘The Magic School Bus,’ Dies at 79",He memorably portrayed a frizzy-haired science teacher roping her elementary school class into adventures aboard a shape-shifting yellow bus.,"Bruce Degen, the illustrator of “The Magic School Bus” series of children’s books, which gained a reputation as the clearest and most charming science texts available for elementary school students and have been read by tens of millions of children worldwide, died on Thursday at his home in Newtown, Conn. He was 79.",He memorably portrayed a frizzy-haired science teacher roping her elementary school class into adventures aboard a shape-shifting yellow bus.,Obits,2024-11-11
2024-11-11 00:29:07+00:00,Man Arrested in Shooting That Killed One at Tuskegee University,"The shooting, which also wounded 12 people, happened early on Sunday as crowds gathered at the historically Black school to celebrate the final day of its 100th homecoming week.","A 25-year-old man was charged in connection with a shooting on the campus of Tuskegee University in Alabama early Sunday morning that left one person dead and a dozen others wounded as crowds gathered for the school’s homecoming celebration, the authorities said.","The shooting, which also wounded 12 people, happened early on Sunday as crowds gathered at the historically Black school to celebrate the final day of its 100th homecoming week.",Express,2024-11-11
2024-11-11 00:54:42+00:00,"Chaos, Provocations and Violence: How Attacks on Israeli Soccer Fans Unfolded","Antisemitic assaults on visiting Israeli soccer fans, and incendiary chants and attacks by some Israelis: Here’s what we know so far about the violence in Amsterdam last week.","Early Thursday morning, taxi drivers gathered en masse outside Amsterdam’s Holland Casino. Hours before, Israeli soccer fans had stolen and burned a Palestinian flag, while others attacked a cab — and the drivers, the police said, were heeding an online call to “mobilize.”","Antisemitic assaults on visiting Israeli soccer fans, and incendiary chants and attacks by some Israelis: Here’s what we know so far about the violence in Amsterdam last week.",Foreign,2024-11-11
2024-11-11 01:00:03+00:00,This Is the Cake We Baked,"Talking to people who helped make Donald Trump’s victory happen, and others.",On This Week’s Episode:,"Talking to people who helped make Donald Trump’s victory happen, and others.",Podcasts,2024-11-11
2024-11-11 01:00:34+00:00,Military Judge Postpones Guilty Plea Proceedings in Sept. 11 Case,The judge asked defense and prosecution lawyers to settle on a date for the accused mastermind of the terrorist attacks to plead guilty.,"A military judge on Sunday postponed a hearing to receive the guilty plea of Khalid Shaikh Mohammed, who is accused of masterminding the Sept. 11 attacks, so that prosecutors can seek again to nullify the plea deal.",The judge asked defense and prosecution lawyers to settle on a date for the accused mastermind of the terrorist attacks to plead guilty.,Washington,2024-11-11
2024-11-11 02:30:01+00:00,"No Corrections: Nov. 11, 2024","No corrections appeared in print on Monday, Nov. 11, 2024.","Errors are corrected during the press run whenever possible, so some errors noted here may not have appeared in all editions.","No corrections appeared in print on Monday, Nov. 11, 2024.",Corrections,2024-11-11
2024-11-11 05:00:13+00:00,Trump’s Return Hangs Over U.N. Climate Negotiations,The election of Donald J. Trump is sapping momentum from global climate talks as diplomats brace for his pro-fossil-fuel agenda.,"World leaders gathering in Baku, the capital of Azerbaijan, on Monday for a global climate summit face a bleak reality: The United States, the country responsible for pumping the most greenhouse gases into the atmosphere, is expected to soon drop out of the fight against climate change.",The election of Donald J. Trump is sapping momentum from global climate talks as diplomats brace for his pro-fossil-fuel agenda.,Climate,2024-11-11
2024-11-11 05:01:06+00:00,Why Is a Petrostate Holding This Year’s Climate Talks?,"The economy of Azerbaijan, host of COP29, relies almost entirely on the fossil fuels that are the main driver of global warming.","Heading into this month’s United Nations-sponsored climate negotiations, the world is contending with rising climate chaos and declining democracy.","The economy of Azerbaijan, host of COP29, relies almost entirely on the fossil fuels that are the main driver of global warming.",Climate,2024-11-11
2024-11-11 05:01:08+00:00,"Quote of the Day: These A.I. Glasses Tell All at a Glance, and Bring Up Thorny Issues","Quotation of the Day for Monday, November 11, 2024.",“This is the kind of technology that could be incredibly useful and incredibly destructive.”,"Quotation of the Day for Monday, November 11, 2024.",Summary,2024-11-11
2024-11-11 05:01:12+00:00,Will Trump Rekindle a Bromance With Kim Jong-un? South Koreans Worry.,Donald J. Trump’s second term brings uncertainty to the Korean Peninsula as nuclear tensions run high. North Korea’s leader may see a chance to re-engage.,"During his 2024 election campaign, Donald J. Trump described the United States’ alliance with South Korea as a terrible bargain for his country, accusing the Asian ally of not paying enough ​for the 28,500 ​American troops ​stationed on its soil.",Donald J. Trump’s second term brings uncertainty to the Korean Peninsula as nuclear tensions run high. North Korea’s leader may see a chance to re-engage.,Foreign,2024-11-11
2024-11-11 05:03:05+00:00,Monday Briefing,What Trump means for the Middle East.,"As president, Donald Trump was a staunch supporter of Israel, recognizing Jerusalem as its capital, cutting off aid to the U.N. agency that supports Palestinian refugees and presenting a peace plan that favored Israel. Yet he has also publicly called for the war in Gaza to stop, saying in April, “Israel has to be very careful, because you’re losing a lot of the world.”",What Trump means for the Middle East.,NYTNow,2024-11-11
2024-11-11 05:18:00+00:00,Why Did Tens of Thousands of Chinese Students Go on Night Bike Rides?,"Making the impromptu five-hour ride between two Chinese cities became a craze among young people. But as their numbers swelled, the authorities shut it down.","The students would emerge on their bikes, in the tens of thousands, seemingly out of nowhere. Like a flash mob on wheels, they rode for hours in the night, by the light of streetlamps, sometimes bursting into verses of the Chinese national anthem. Some carried Chinese flags.","Making the impromptu five-hour ride between two Chinese cities became a craze among young people. But as their numbers swelled, the authorities shut it down.",Foreign,2024-11-11
2024-11-11 06:00:12+00:00,The Quiet Development Shaking America’s Power,The United States can no longer depend on the loyalty of its friends.,"With the stunning comeback of Donald Trump as president, America’s allies are scrambling. Behind their sober messages of congratulation is a palpable anxiety that Washington will soon treat them as mere pawns on the global chessboard. It would be quite a change. Under President Biden’s leadership, the United States — sharpening its rivalry with China and seeking to counter Russia’s invasion of Ukraine — put great store in strengthening its alliances and partnerships.",The United States can no longer depend on the loyalty of its friends.,OpEd,2024-11-11
2024-11-11 06:00:13+00:00,"‘Dune: Prophecy,’ Plus 6 Things to Watch on TV this Week","Tune into the premiere of the HBO series, see whom Joan Vassos picks for her final rose on “The Bachelorette” and catch up on news.","Between streaming and cable, there is a seemingly endless variety of things to watch. Here is a selection of TV shows and specials that are available to watch live or stream this week, Nov. 11-17. Details and times are subject to change.","Tune into the premiere of the HBO series, see whom Joan Vassos picks for her final rose on “The Bachelorette” and catch up on news.",Culture,2024-11-11
2024-11-11 06:08:57+00:00,Trump Names Thomas Homan ‘Border Czar’ With a Wide Portfolio,"Mr. Homan, a senior immigration official in the last Trump administration, has said that workplace raids would restart under the new government.","President-elect Donald J. Trump said late Sunday that he had named Thomas D. Homan, a senior immigration official in his last administration, as the “border czar” in charge of the nation’s borders and its maritime and aviation security.","Mr. Homan, a senior immigration official in the last Trump administration, has said that workplace raids would restart under the new government.",Express,2024-11-11
2024-11-11 07:13:40+00:00,Mattel Mistakenly Lists Porn Site on Packaging for ‘Wicked’ Dolls,The site has a similar address to one that promotes a film adaptation of the hit musical. The toymaker apologized for the “unfortunate error.”,"All may be good in the Land of Oz, but the same can’t be said for the world of Mattel.",The site has a similar address to one that promotes a film adaptation of the hit musical. The toymaker apologized for the “unfortunate error.”,Express,2024-11-11
2024-11-11 08:00:11+00:00,He’s Eric Adams’s Third N.Y.P.D. Boss. Does He Have Staying Power?,"Thomas Donlon wants the job of police commissioner permanently, and he’s been acting as though he has it as he navigates friction and uncertainty.","Mayor Eric Adams’s decision to appoint Thomas Donlon, a 71-year-old former F.B.I. investigator, as New York’s interim police commissioner seemed to bring a sense of stability to a department rocked by several federal inquiries. It didn’t last long.","Thomas Donlon wants the job of police commissioner permanently, and he’s been acting as though he has it as he navigates friction and uncertainty.",Metro,2024-11-11
2024-11-11 08:00:16+00:00,Trump’s Gains Among Latinos Push a Civil Rights Group to Reflect on Its Past,"From its founding nearly a century ago, LULAC encouraged Hispanic people to embrace American identity even as it fought discrimination. The 2024 election result presents a dilemma on both fronts.","On a cold and rainy Sunday in February 1929, a group of Latino men in dapper suits and boater hats gathered in a convention hall in Corpus Christi, Texas, to forge a new Latino civil rights group.","From its founding nearly a century ago, LULAC encouraged Hispanic people to embrace American identity even as it fought discrimination. The 2024 election result presents a dilemma on both fronts.",Politics,2024-11-11
2024-11-11 08:00:22+00:00,Spelling Bee Forum,Feeling stuck on today’s puzzle? We can help.,"Hi busy bees! Welcome to today’s Spelling Bee forum. There are a number of terms that appear in both this article and other online discussions of the Spelling Bee; a glossary of those terms compiled by Monicat, a Times reader, can be found below.",Feeling stuck on today’s puzzle? We can help.,Games,2024-11-11
2024-11-11 08:00:23+00:00,How Trump Divides Chinese Who Aspire to Democracy,A new HBO documentary about opposition to autocrats says a lot about the complex politics the president-elect inspires for people fleeing countries.,"The long and loud campaign of Donald J. Trump, and now his re-election as president, have prompted deep divisions among many Chinese who advocate for democracy.",A new HBO documentary about opposition to autocrats says a lot about the complex politics the president-elect inspires for people fleeing countries.,Business,2024-11-11
2024-11-11 08:00:40+00:00,"After Trump’s Victory, Mayoral Candidates Unite Against Adams and Cuomo","Unseating Eric Adams as mayor of New York was a hot topic at a political gathering in Puerto Rico, as Democrats reflected on the impact of Donald J. Trump’s win.","At beachfront hotel bars, tropical pool parties and crowded ballroom dance floors, a pressing matter closer to home inevitably arose: How would New York City navigate four years of Donald J. Trump as president, and who might be the best mayor to lead that effort?","Unseating Eric Adams as mayor of New York was a hot topic at a political gathering in Puerto Rico, as Democrats reflected on the impact of Donald J. Trump’s win.",Metro,2024-11-11
2024-11-11 08:00:40+00:00,Who Has the Best View of the Chrysler Building? These Bees.,"On and around some of New York City’s most iconic buildings, beehives are buzzing.","At many corporate offices in Manhattan, the level of activity remains well below its prepandemic levels. But on and around some of New York City’s most iconic buildings, beehives are buzzing seven days a week.","On and around some of New York City’s most iconic buildings, beehives are buzzing.",Metropolitan,2024-11-11
2024-11-11 08:15:21+00:00,Shigeru Ishiba Wins Vote to Remain as Japan’s Prime Minister,"Parliament voted Monday to stick with Mr. Ishiba, who will lead a minority government after his party suffered heavy losses in an election last month.","Despite leading his party to big losses in a snap general election last month, Shigeru Ishiba, the prime minister of Japan, won a vote in Parliament on Monday to carry on as the country’s leader.","Parliament voted Monday to stick with Mr. Ishiba, who will lead a minority government after his party suffered heavy losses in an election last month.",Foreign,2024-11-11
2024-11-11 08:31:02+00:00,Throngs of Cyclists Ride for Hours Between Two Chinese Cities,"They were making the 40-mile journey from Zhengzhou, the capital of Henan Province, to the neighboring city of Kaifeng, a cycling trip that can take up to five hours one-way.","They were making the 40-mile journey from Zhengzhou, the capital of Henan Province, to the neighboring city of Kaifeng, a cycling trip that can take up to five hours one-way.","They were making the 40-mile journey from Zhengzhou, the capital of Henan Province, to the neighboring city of Kaifeng, a cycling trip that can take up to five hours one-way.",,2024-11-11
2024-11-11 10:00:20+00:00,Women Get Less Exercise Than Men. It’s a Problem.,"Experts say the fitness gender gap is because women have less time to work out, and that their health is paying the price.","After a full Saturday shuttling her two kids to soccer and play-dates across Manhattan, Neha Ruch, 39, finally carved out a few precious minutes to exercise at 6:15 p.m. She didn’t even bother to change clothes before hopping onto her elliptical machine in a closet-turned-home-gym.","Experts say the fitness gender gap is because women have less time to work out, and that their health is paying the price.",Well,2024-11-11
2024-11-11 10:00:34+00:00,The Unspoken Grief of Never Becoming a Grandparent,A growing number of Americans are choosing not to have children. Their parents are grappling with what that means for them.,"Lydia Birk, 56, has held on to her favorite copy of “The Velveteen Rabbit” since her three children — now in their 20s and 30s — were young.",A growing number of Americans are choosing not to have children. Their parents are grappling with what that means for them.,Well,2024-11-11
2024-11-11 10:00:35+00:00,Why Are Cities Still Spending Big on Convention Centers?,"Cities are spending more than ever to land the biggest events, but companies have long pulled back on spending for annual conferences and attendance has dwindled.",Are sprawling convention centers worth the money cities need to spend on them?,"Cities are spending more than ever to land the biggest events, but companies have long pulled back on spending for annual conferences and attendance has dwindled.",Business,2024-11-11
2024-11-11 10:00:50+00:00,"Fewer Crowds, Bargain Prices: ‘Quiet Season’ Cruising in the Mediterranean","Overtourism and summer heat have increased the allure of off-season travel in Europe, and the cruise industry is taking note with more winter itineraries. Added bonus: cheaper fares.","After a summer of overtourism in cruise ports like Barcelona and Amsterdam, and talk of caps on ship arrivals in Greece and other places, the cruise industry has come up with a surprising suggestion for where to sail in winter: Europe.","Overtourism and summer heat have increased the allure of off-season travel in Europe, and the cruise industry is taking note with more winter itineraries. Added bonus: cheaper fares.",Travel,2024-11-11
2024-11-11 10:00:51+00:00,I Gave My Son the Books I Loved. He Chose ‘Heidi’ Instead.,"What a 19th-century Swiss novel, and a young fan’s pilgrimage to the Alps, taught me about fatherhood.","I went to the Alps in August because my son — a New York City third grader obsessed with baseball, projectiles and YouTube — fell in love this summer with the Swiss children’s novel “Heidi.”","What a 19th-century Swiss novel, and a young fan’s pilgrimage to the Alps, taught me about fatherhood.",BookReview,2024-11-11
2024-11-11 10:01:06+00:00,Alcohol Brands Tap the Art World to Woo Younger Drinkers,Will labels and bottles designed by artists gin up enthusiasm among an increasingly abstinent generation?,"In October, Dom Pérignon hosted a party at the Brant Foundation in New York City’s East Village, thousands of miles from its home in the Champagne region of France. At the party, which celebrated Dom Pérignon’s partnership with the estate of Jean-Michel Basquiat, the actresses Zoë Kravitz and Natasha Lyonne, the model Evan Mock and Raul Lopez, the designer of the subversive Luar fashion label, sipped Dom as they swayed to music from the Mudd Club habitué DJ Justin Strauss.",Will labels and bottles designed by artists gin up enthusiasm among an increasingly abstinent generation?,Styles,2024-11-11
2024-11-11 10:01:09+00:00,Allison Tolman Knows Her Worth,"The actress broke out in “Fargo” and has spent the decade since convincing producers she is a leading lady. Now she’s starring in “St. Denis Medical,” a new hospital mockumentary.","“Hello, baby,” the actress Allison Tolman said to a handsome male. “Look at your mustache.” He crawled into her lap.","The actress broke out in “Fargo” and has spent the decade since convincing producers she is a leading lady. Now she’s starring in “St. Denis Medical,” a new hospital mockumentary.",Culture,2024-11-11
2024-11-11 10:01:58+00:00,5 Vintage Crime Novels Spiked With Peril and Pitfalls,"Our columnist on a handful of recently reissued crime novels, all of which are worth your time.","Most of my recent conversations about books have revolved around one common pursuit: escape. The news is unrelenting, and crises personal and political abound. No wonder so many people are seeking out books that are either completely untethered to current reality or soothe us in the gentlest, coziest ways.","Our columnist on a handful of recently reissued crime novels, all of which are worth your time.",BookReview,2024-11-11
2024-11-11 10:02:00+00:00,How a Colombian Influencer Made Recycling Cool,The character Marce the Recycler has created an enthusiastic dedication to proper waste separation among her devoted fans.,"In an enormous warehouse filled floor to ceiling with plastic, glass and newspapers, Sara Samaniego lip-syncs to a rap song, dressed in her trademark blue jumpsuit and braids.",The character Marce the Recycler has created an enthusiastic dedication to proper waste separation among her devoted fans.,Foreign,2024-11-11
2024-11-11 10:02:12+00:00,Jewelry With the Seafaring Spirit of ‘Treasure Island’,Van Cleef & Arpels’s latest collection draws from Robert Louis Stevenson’s classic adventure novel.,"In 1906, the Belgian lapidary and diamond dealer Alfred Van Cleef and his brother-in-law Salomon Arpels opened a jewelry boutique on the ground floor of the Hôtel de Ségur, an 18th-century private mansion in Paris’s First Arrondissement that had once belonged to a prominent winemaker. That same year, the pair produced one of their first custom orders: a scale model of the then-ultramodern Varuna of New York yacht that featured a yellow-gold double-masted deck and hull set in green, alabaster and crimson enamel on a sea of solid jasper. Meant to ornament a tabletop, it initially had an electric butler’s bell inside its funnel. Over the following decades, the house’s decorative objects and jewelry would return to their maritime iconography: a 1935 minaudière was adorned with a three-pronged platinum-and-diamond-encrusted clasp resembling a trio of overlapping sails billowing in the wind; pendant charms from the mid-20th century depicted nautical scenes with bejeweled sloops and lapis lazuli waves.",Van Cleef & Arpels’s latest collection draws from Robert Louis Stevenson’s classic adventure novel.,TStyle,2024-11-11
2024-11-11 10:02:13+00:00,The New Era of West African Fine Dining,"Across the diaspora, chefs are sharing knowledge about long-overlooked cuisines — and creating some of the most exciting dishes you’ll find in Europe and America today.","IN THE MINIMALIST dining room of MoSuke, a restaurant on Paris’s Left Bank, a black sauce fills the hollow of a white plate. The ingredient necessary to achieve this depth of color comes from a tree that grows nearly 3,000 miles away in the rainforests of Cameroon: Afrostyrax lepidophyllus, whose every part — trunk, leaves, the round brown seeds called country onions — gives off the scent of garlic, most strongly after rain. The Bassa people, who live in the nation’s south, cut the bark into strips, then burn, crush and press it through a sieve until it’s fine as gunpowder.","Across the diaspora, chefs are sharing knowledge about long-overlooked cuisines — and creating some of the most exciting dishes you’ll find in Europe and America today.",TStyle,2024-11-11
2024-11-11 10:02:30+00:00,How ‘The Wild Robot’ Was Born in a Weedy Patch of Manhattan,"Peter Brown’s obsession with the abandoned railway that became the High Line led to two best sellers — including “The Wild Robot,” which is now a blockbuster movie.",Peter Brown was in Manhattan’s meatpacking district in 2002 when he noticed a few hardy branches dangling from a dingy overpass near Gansevoort Street.,"Peter Brown’s obsession with the abandoned railway that became the High Line led to two best sellers — including “The Wild Robot,” which is now a blockbuster movie.",Books,2024-11-11
2024-11-11 10:02:32+00:00,7 Shows That Make This Art Festival Worth the Trip to California,The sprawling PST festival of more than 70 exhibitions doesn’t quite live up to its theme of art and science colliding. But there is a handful of impressive entries.,"Bigger and bulkier than ever, the art omnibus formerly called “Pacific Standard Time,” now known by the snappier “PST,” is making its once-every-several-years appearance across Southern California this fall. Bankrolled by the Getty Foundation and centered in Los Angeles, the $20.4 million initiative is made up of more than 70 exhibitions, organized by museums and nonprofit spaces large and small, and gathered, with varying degrees of cogency, under a single thematic banner: “PST ART: Art & Science Collide.”",The sprawling PST festival of more than 70 exhibitions doesn’t quite live up to its theme of art and science colliding. But there is a handful of impressive entries.,Culture,2024-11-11
2024-11-11 10:02:39+00:00,The Jazz-Metal Trio PainKiller’s Classic Lineup Revs Up Again,"Mick Harris, Bill Laswell and John Zorn’s new album, “Samsara” — their first in 30 years — arrives as Laswell battles health troubles that “opened up a new direction.”","In the spring of 1991, John Zorn, the radically eclectic composer and saxophonist, hopped into a cab outside his East Village apartment. Already inside was Mick Harris, a young drummer visiting from Britain whose band, Napalm Death, had become the leading exemplar of grindcore, a caustic, velocity-crazed blend of punk and metal. Their destination: Greenpoint Studios, the Brooklyn headquarters of the prolific bassist-producer Bill Laswell, Zorn’s friend and collaborator.","Mick Harris, Bill Laswell and John Zorn’s new album, “Samsara” — their first in 30 years — arrives as Laswell battles health troubles that “opened up a new direction.”",Culture,2024-11-11
2024-11-11 10:02:41+00:00,Everyone Else Is Giving a Standing Ovation. Do I Have To?,"Theatergoers and other performing-arts lovers are noticing the practice seems to have become the rule, not the exception.",Do you have a question for our culture writers and editors? Ask us here.,"Theatergoers and other performing-arts lovers are noticing the practice seems to have become the rule, not the exception.",Arts&Leisure,2024-11-11
2024-11-11 10:02:49+00:00,"To Understand Egypt, Meet My Friend, a Political Prisoner","When we were younger, my friend Alaa Abd El Fattah and I didn’t know just how intimately prison, and state violence, would shape our lives.","Shortly after I arrived at Tora Maximum Security Prison in Cairo, a prisoner with a trendy haircut and glasses entered my cell, handed me a plastic bag and whispered, “From Alaa.” Inside the bag were several packs of cigarettes, the currency of the prison; blue and white T-shirts, the only colors prisoners could wear; and small plastic packets of tea and sugar.","When we were younger, my friend Alaa Abd El Fattah and I didn’t know just how intimately prison, and state violence, would shape our lives.",OpEd,2024-11-11
